{
  "taskId": "FV-P07-T011",
  "phaseId": "FV-P07",
  "title": "Phase 07F — Historique fonctionnel local",
  "objective": "Ajouter un historique local, opt-in, transparent, supprimable et sans audio.",
  "status": "draft",
  "createdAt": "2026-07-22T00:00:00+02:00",
  "updatedAt": "2026-07-22T00:00:00+02:00",
  "approvedByJudge": false,
  "scope": {"included": ["décision privacy", "schéma SQLite versionné", "recherche et suppression", "tests de migration temporaires"], "excluded": ["audio", "synchronisation", "base réelle", "migration de données utilisateur sans autorité"]},
  "allowedPaths": ["À délimiter après décision de rétention"],
  "readOnlyPaths": [".env", ".env.*", ".git/**", "C:/Users/exhorte/AppData/Local/Fluent/**"],
  "forbiddenPaths": [".git/**", ".env", ".env.*", "secrets/**", "credentials/**", "C:/Users/exhorte/AppData/Local/Fluent/**"],
  "allowedCommandFamilies": ["À définir dans le contrat approuvé"],
  "forbiddenCommandFamilies": ["git push", "git reset", "git clean", "migration base réelle"],
  "acceptanceCriteria": ["opt-in explicite", "rétention et suppression définies", "aucun audio", "migrations testées sans base réelle", "suppression vérifiable"],
  "requiredTests": ["repository SQLite", "migrations temporaires", "privacy", "build Release", "suite complète"],
  "requiredReviews": ["Judge plan", "privacy/sécurité", "persistence", "Judge final", "acceptation utilisateur"],
  "requiredEvidence": ["ADR ou décision privacy", "contrat de rétention", "preuves de suppression"],
  "risks": ["rétention excessive", "texte sensible", "migration destructrice", "suppression incomplète"],
  "rollbackPlan": ["Désactiver les écritures nouvelles ; ne jamais effacer de données existantes automatiquement."],
  "dependencies": ["décision produit/privacy", "schéma et stratégie de migration validés"],
  "humanApprovals": ["Requis avant persistance de texte de dictée et toute migration de données réelles."],
  "maxRepairCycles": 2
}
