{
  "taskId": "FV-P07-T012",
  "phaseId": "FV-P07",
  "title": "Phase 07G — Paramètres fonctionnels",
  "objective": "Créer des préférences locales versionnées, validées et réversibles pour les comportements non sensibles de Fluent.",
  "status": "draft",
  "createdAt": "2026-07-22T00:00:00+02:00",
  "updatedAt": "2026-07-22T00:00:00+02:00",
  "approvedByJudge": false,
  "scope": {"included": ["modèle de préférences", "validation et valeurs sûres", "UI accessible", "migration de test et reset"], "excluded": ["secrets", "tokens", "consentement Cloud persistant", "écriture registre", "données réelles"]},
  "allowedPaths": ["À délimiter après choix du modèle de préférences"],
  "readOnlyPaths": [".env", ".env.*", ".git/**"],
  "forbiddenPaths": [".git/**", ".env", ".env.*", "secrets/**", "credentials/**", "*.key", "*.pem", "*.pfx"],
  "allowedCommandFamilies": ["À définir dans le contrat approuvé"],
  "forbiddenCommandFamilies": ["git push", "git reset", "git clean", "reg add", "reg delete"],
  "acceptanceCriteria": ["préférences validées et réversibles", "reset explicite", "aucun secret/token", "Cloud activation/consentement restent session-only"],
  "requiredTests": ["validation", "migration temporaire", "WPF/accessibilité", "build Release", "suite complète"],
  "requiredReviews": ["Judge plan", "security/privacy", "persistence", "WPF", "Judge final"],
  "requiredEvidence": ["modèle de préférences", "matrice valeurs par défaut", "tests de reset/migration"],
  "risks": ["préférence dangereuse", "persistance de secret", "régression hotkey", "migration non réversible"],
  "rollbackPlan": ["Conserver les valeurs sûres et désactiver la nouvelle persistance si une migration échoue."],
  "dependencies": ["décisions sur hotkey, capsule et politique d'historique"],
  "humanApprovals": ["Toute extension de portée vers secrets, registre ou consentement Cloud persistant exige une nouvelle autorisation."],
  "maxRepairCycles": 2
}
