{
  "taskId": "FV-P07-T009",
  "phaseId": "FV-P07",
  "title": "Phase 07D — Réécriture Gemini authentifiée",
  "objective": "Rendre Gemini accessible uniquement via le backend Fluent, une session Supabase valide, une activation et un consentement explicites, en conservant le fallback local exact.",
  "status": "draft",
  "createdAt": "2026-07-22T00:00:00+02:00",
  "updatedAt": "2026-07-22T00:00:00+02:00",
  "approvedByJudge": false,
  "scope": {"included": ["Configuration Desktop sans secret", "backend Gemini déployé et contrôlé", "tests et smoke contrôlé"], "excluded": ["clé dans le dépôt/Desktop", "DeepSeek live", "routage automatique", "télémétrie de contenu"]},
  "allowedPaths": ["À définir après autorisation de déploiement et revue du backend"],
  "readOnlyPaths": [".env", ".env.*", ".git/**"],
  "forbiddenPaths": [".git/**", ".env", ".env.*", "secrets/**", "credentials/**", "*.key", "*.pem", "*.pfx"],
  "allowedCommandFamilies": ["À définir dans le contrat approuvé"],
  "forbiddenCommandFamilies": ["git push", "git reset", "git clean", "lecture de secret"],
  "acceptanceCriteria": ["07B clôturée", "backend authentifié déployé avec autorité utilisateur", "succès Gemini et chemins 401/403/429/503/délai avec fallback local exact", "aucune donnée sensible en logs"],
  "requiredTests": ["unitaires Cloud/backend", "build Release", "suite complète", "smoke utilisateur autorisé"],
  "requiredReviews": ["Judge plan", "sécurité/privacy", "revue déploiement", "Judge final", "acceptation utilisateur"],
  "requiredEvidence": ["contrat approuvé", "configuration server-side attestée sans secret", "preuves de smoke désensibilisées"],
  "risks": ["secret", "coût", "déploiement", "envoi de texte sans consentement", "fallback incorrect"],
  "rollbackPlan": ["Retirer l'URL backend Desktop ou rendre le backend indisponible ; Fluent revient au mode local."],
  "dependencies": ["clôture 07B", "revue 06B", "autorisation explicite de déploiement et de coût"],
  "humanApprovals": ["Requis avant toute configuration externe, secret, déploiement ou appel Gemini."],
  "maxRepairCycles": 2
}
