{
  "taskId": "FV-P07-T010",
  "phaseId": "FV-P07",
  "title": "Phase 07E — Tableau de bord dynamique",
  "objective": "Rendre l'Overview dynamique à partir de sources locales définies, sans métrique inventée ni persistance implicite.",
  "status": "draft",
  "createdAt": "2026-07-22T00:00:00+02:00",
  "updatedAt": "2026-07-22T00:00:00+02:00",
  "approvedByJudge": false,
  "scope": {"included": ["modèles de métriques locales", "états UI chargement/vide/erreur", "tests de présentation"], "excluded": ["historique de texte", "télémétrie", "compte Cloud", "données simulées présentées comme réelles"]},
  "allowedPaths": ["À délimiter après inventaire des métriques"],
  "readOnlyPaths": [".env", ".env.*", ".git/**"],
  "forbiddenPaths": [".git/**", ".env", ".env.*", "secrets/**", "credentials/**"],
  "allowedCommandFamilies": ["À définir dans le contrat approuvé"],
  "forbiddenCommandFamilies": ["git push", "git reset", "git clean"],
  "acceptanceCriteria": ["chaque donnée a une source réelle", "états vides/erreurs accessibles", "aucun contenu de dictée stocké ou affiché sans décision 07F"],
  "requiredTests": ["unitaires de calcul", "tests de présentation", "build Release", "suite complète"],
  "requiredReviews": ["Judge plan", "revue WPF/accessibilité", "privacy", "Judge final"],
  "requiredEvidence": ["matrice source-métrique", "captures/smoke sans données sensibles", "tests"],
  "risks": ["statistique trompeuse", "métrique sans source", "fuite de contenu"],
  "rollbackPlan": ["Revenir aux statuts élémentaires véridiques de l'Overview."],
  "dependencies": ["métriques et cycle de vie explicitement définis"],
  "humanApprovals": ["Aucune donnée utilisateur nouvelle ne peut être persistée sans autorisation."],
  "maxRepairCycles": 2
}
